{
  "schema": "worker-result-v1",
  "result_id": "result-1",
  "run_id": "run-1",
  "assignment_id": "assignment-1",
  "assignment_sha256": "eeeeeeeeeeeeeeeeeeeeeeeeeeeeeeeeeeeeeeeeeeeeeeeeeeeeeeeeeeeeeeee",
  "attempt": 1,
  "worker_binding": {"worker_task_id": "worker-1", "worker_profile_id": "analysis-reader"},
  "started_at": "2026-09-01T00:00:00Z",
  "completed_at": "2026-09-01T00:01:00Z",
  "outcome": "completed",
  "observed_workspaces": [],
  "reported_changes": [],
  "commands": [],
  "checks": [{"check_id": "readback", "status": "passed", "receipt_sha256": "ffffffffffffffffffffffffffffffffffffffffffffffffffffffffffffffff"}],
  "evidence": [{"evidence_id": "evidence-1", "kind": "readback", "uri": "artifact:1", "sha256": "0000000000000000000000000000000000000000000000000000000000000000", "size_bytes": 1}],
  "reported_scope_deviations": [],
  "summary": "Read-only assignment completed"
}
